{
  "task_definition_id": "td-synthetic-alttext",
  "action_id": "act-synthetic-alttext-001",
  "version": "1.0",
  "status": "frozen",
  "synthetic": true,
  "instructions_ref": "examples/synthetic-action/instructions.md",
  "output_schema_ref": "schemas/core/submission.schema.json#/definitions/unit_result",
  "content_hash": "sha256:0000000000000000000000000000000000000000000000000000000000000000",
  "frozen_at": "2026-08-09T09:30:00+08:00",
  "calibration_status": "not_started",
  "acceptance_policy": {
    "rules": [
      {
        "id": "len",
        "layer": "L2_rule",
        "rule": "描述长度 40-200 字符",
        "error_code": "E_RULE_LENGTH_OUT_OF_RANGE",
        "redline": false
      },
      {
        "id": "no_sensitive",
        "layer": "L2_rule",
        "rule": "不得引入 L1+ 敏感内容",
        "error_code": "E_REDLINE_SENSITIVE_DATA",
        "redline": true
      }
    ],
    "combination_rule": "all_layers_must_pass",
    "consensus_rule": "human_arbitration",
    "l4_sample_ratio": 1.0,
    "max_rework_rounds": 2,
    "rework_open_to": "anyone"
  },
  "workload_envelope": {
    "unit_of_measure": "unit",
    "human_minutes": { "p50": 3, "p90": 8, "basis": "assumed" },
    "notes": "SYNTHETIC assumed"
  }
}
